{
  "$schema": "../../../schemas/component.schema.json",
  "schemaVersion": "1.0.0",
  "identity": {
    "id": "board.arduino.nano",
    "name": "Arduino Nano",
    "category": "microcontroller",
    "subCategory": "arduino"
  },
  "simulation": {
    "kind": "microcontroller",
    "effects": ["firmware", "electrical", "visual-state"],
    "implemented": true
  },
  "properties": {
    "logicVoltage": { "type": "number", "default": 5, "minimum": 3.3, "maximum": 5, "unit": "V", "simulationUpdate": "rerun" },
    "clockMHz": { "type": "number", "default": 16, "minimum": 8, "maximum": 16, "unit": "MHz", "simulationUpdate": "rerun" },
    "usbPowered": { "type": "boolean", "default": true, "simulationUpdate": "rerun" }
  },
  "terminals": [
    { "id": "vin", "label": "VIN", "type": "power-output" },
    { "id": "5v", "label": "5V", "type": "power-output" },
    { "id": "3v3", "label": "3V3", "type": "power-output" },
    { "id": "gnd", "label": "GND", "type": "ground" },
    { "id": "rst", "label": "RST", "type": "reset" },
    { "id": "aref", "label": "AREF", "type": "analog-reference" },
    { "id": "d0", "label": "D0/RX", "type": "digital-io" },
    { "id": "d1", "label": "D1/TX", "type": "digital-io" },
    { "id": "d2", "label": "D2", "type": "digital-io" },
    { "id": "d3", "label": "D3", "type": "digital-io" },
    { "id": "d4", "label": "D4", "type": "digital-io" },
    { "id": "d5", "label": "D5", "type": "digital-io" },
    { "id": "d6", "label": "D6", "type": "digital-io" },
    { "id": "d7", "label": "D7", "type": "digital-io" },
    { "id": "d8", "label": "D8", "type": "digital-io" },
    { "id": "d9", "label": "D9", "type": "digital-io" },
    { "id": "d10", "label": "D10", "type": "digital-io" },
    { "id": "d11", "label": "D11", "type": "digital-io" },
    { "id": "d12", "label": "D12", "type": "digital-io" },
    { "id": "d13", "label": "D13", "type": "digital-io" },
    { "id": "a0", "label": "A0", "type": "analog-input" },
    { "id": "a1", "label": "A1", "type": "analog-input" },
    { "id": "a2", "label": "A2", "type": "analog-input" },
    { "id": "a3", "label": "A3", "type": "analog-input" },
    { "id": "a4", "label": "A4/SDA", "type": "analog-input" },
    { "id": "a5", "label": "A5/SCL", "type": "analog-input" },
    { "id": "a6", "label": "A6", "type": "analog-input" },
    { "id": "a7", "label": "A7", "type": "analog-input" }
  ],
  "electricalModel": {
    "type": "microcontroller",
    "primitive": "atmega328p-board",
    "logicVoltage": 5,
    "recommendedPinCurrentAmps": 0.02,
    "absolutePinCurrentAmps": 0.04
  },
  "behavior": {
    "type": "microcontroller",
    "runtime": "arduino-compatible",
    "pinMap": {
      "d0": { "number": 0, "name": "D0/RX", "capabilities": ["digital", "uart-rx"] },
      "d1": { "number": 1, "name": "D1/TX", "capabilities": ["digital", "uart-tx"] },
      "d2": { "number": 2, "name": "D2", "capabilities": ["digital", "interrupt"] },
      "d3": { "number": 3, "name": "D3", "capabilities": ["digital", "pwm", "interrupt"] },
      "d4": { "number": 4, "name": "D4", "capabilities": ["digital"] },
      "d5": { "number": 5, "name": "D5", "capabilities": ["digital", "pwm"] },
      "d6": { "number": 6, "name": "D6", "capabilities": ["digital", "pwm"] },
      "d7": { "number": 7, "name": "D7", "capabilities": ["digital"] },
      "d8": { "number": 8, "name": "D8", "capabilities": ["digital"] },
      "d9": { "number": 9, "name": "D9", "capabilities": ["digital", "pwm"] },
      "d10": { "number": 10, "name": "D10/SS", "capabilities": ["digital", "pwm", "spi-cs"] },
      "d11": { "number": 11, "name": "D11/MOSI", "capabilities": ["digital", "pwm", "spi-mosi"] },
      "d12": { "number": 12, "name": "D12/MISO", "capabilities": ["digital", "spi-miso"] },
      "d13": { "number": 13, "name": "D13/SCK", "capabilities": ["digital", "spi-sck", "led"] },
      "a0": { "number": 14, "analogNumber": 14, "name": "A0", "capabilities": ["analog", "digital"] },
      "a1": { "number": 15, "analogNumber": 15, "name": "A1", "capabilities": ["analog", "digital"] },
      "a2": { "number": 16, "analogNumber": 16, "name": "A2", "capabilities": ["analog", "digital"] },
      "a3": { "number": 17, "analogNumber": 17, "name": "A3", "capabilities": ["analog", "digital"] },
      "a4": { "number": 18, "analogNumber": 18, "name": "A4/SDA", "capabilities": ["analog", "digital", "i2c-sda"] },
      "a5": { "number": 19, "analogNumber": 19, "name": "A5/SCL", "capabilities": ["analog", "digital", "i2c-scl"] },
      "a6": { "analogNumber": 20, "name": "A6", "capabilities": ["analog"] },
      "a7": { "analogNumber": 21, "name": "A7", "capabilities": ["analog"] }
    },
    "buses": {
      "i2c": [{ "id": "wire", "sda": "a4", "scl": "a5" }],
      "spi": [{ "id": "spi", "sck": "d13", "miso": "d12", "mosi": "d11", "defaultCs": "d10" }],
      "uart": [{ "id": "serial", "rx": "d0", "tx": "d1" }]
    },
    "builtInLeds": [
      { "id": "led_builtin", "label": "L", "pin": 13, "terminalId": "d13", "activeHigh": true, "color": "amber" }
    ]
  },
  "visual": {
    "type": "arduino-nano",
    "title": "Arduino Nano",
    "className": "arduino-nano",
    "body": "ATmega328P / 5V",
    "width": 176,
    "height": 330,
    "controls": [
      { "type": "element", "className": "nano-chip", "text": "NANO" }
    ],
    "palette": { "group": "Boards", "subgroup": "Arduino", "icon": "arduino-nano-icon", "order": 11 },
    "terminals": [
      { "id": "d13", "side": "left", "x": 0, "y": 24, "kind": "signal" },
      { "id": "3v3", "side": "left", "x": 0, "y": 44, "kind": "power" },
      { "id": "aref", "side": "left", "x": 0, "y": 64, "kind": "signal" },
      { "id": "a0", "side": "left", "x": 0, "y": 84, "kind": "signal" },
      { "id": "a1", "side": "left", "x": 0, "y": 104, "kind": "signal" },
      { "id": "a2", "side": "left", "x": 0, "y": 124, "kind": "signal" },
      { "id": "a3", "side": "left", "x": 0, "y": 144, "kind": "signal" },
      { "id": "a4", "side": "left", "x": 0, "y": 164, "kind": "signal" },
      { "id": "a5", "side": "left", "x": 0, "y": 184, "kind": "signal" },
      { "id": "a6", "side": "left", "x": 0, "y": 204, "kind": "signal" },
      { "id": "a7", "side": "left", "x": 0, "y": 224, "kind": "signal" },
      { "id": "5v", "side": "left", "x": 0, "y": 244, "kind": "power" },
      { "id": "rst", "side": "left", "x": 0, "y": 264, "kind": "signal" },
      { "id": "gnd", "side": "left", "x": 0, "y": 284, "kind": "ground" },
      { "id": "vin", "side": "left", "x": 0, "y": 304, "kind": "power" },
      { "id": "d12", "side": "right", "x": 176, "y": 24, "kind": "signal" },
      { "id": "d11", "side": "right", "x": 176, "y": 44, "kind": "signal" },
      { "id": "d10", "side": "right", "x": 176, "y": 64, "kind": "signal" },
      { "id": "d9", "side": "right", "x": 176, "y": 84, "kind": "signal" },
      { "id": "d8", "side": "right", "x": 176, "y": 104, "kind": "signal" },
      { "id": "d7", "side": "right", "x": 176, "y": 124, "kind": "signal" },
      { "id": "d6", "side": "right", "x": 176, "y": 144, "kind": "signal" },
      { "id": "d5", "side": "right", "x": 176, "y": 164, "kind": "signal" },
      { "id": "d4", "side": "right", "x": 176, "y": 184, "kind": "signal" },
      { "id": "d3", "side": "right", "x": 176, "y": 204, "kind": "signal" },
      { "id": "d2", "side": "right", "x": 176, "y": 224, "kind": "signal" },
      { "id": "d1", "side": "right", "x": 176, "y": 244, "kind": "signal" },
      { "id": "d0", "side": "right", "x": 176, "y": 264, "kind": "signal" }
    ]
  }
}
