{
  "$schema": "../../../schemas/component.schema.json",
  "schemaVersion": "1.0.0",
  "identity": {
    "id": "transistor.bjt.2n3904",
    "name": "2N3904 NPN Transistor",
    "category": "semiconductor",
    "subCategory": "bjt-npn"
  },
  "simulation": {
    "kind": "active-electrical",
    "effects": [
      "electrical",
      "visual-state"
    ],
    "implemented": true,
    "notes": [
      "Educational electrical rules enabled: wiring, activation, floating inputs and current/voltage limit diagnostics."
    ]
  },
  "properties": {
    "polarity": {
      "type": "string",
      "default": "NPN",
      "simulationUpdate": "none"
    },
    "package": {
      "type": "string",
      "default": "TO-92",
      "simulationUpdate": "none"
    },
    "maxCollectorCurrentAmps": {
      "type": "number",
      "default": 0.2,
      "minimum": 0,
      "maximum": 10,
      "unit": "A",
      "simulationUpdate": "rerun"
    },
    "gainHfe": {
      "type": "number",
      "default": 100,
      "minimum": 1,
      "maximum": 5000,
      "simulationUpdate": "rerun"
    }
  },
  "terminals": [
    {
      "id": "collector",
      "label": "C",
      "type": "transistor-collector"
    },
    {
      "id": "base",
      "label": "B",
      "type": "transistor-base"
    },
    {
      "id": "emitter",
      "label": "E",
      "type": "transistor-emitter"
    }
  ],
  "electricalModel": {
    "type": "bjt-transistor",
    "polarity": "NPN",
    "maxCollectorCurrentProperty": "maxCollectorCurrentAmps",
    "gainProperty": "gainHfe"
  },
  "visual": {
    "type": "2n3904-transistor",
    "title": "2N3904",
    "className": "maker-bjt-transistor",
    "body": "NPN",
    "width": 150,
    "height": 104,
    "controls": [
      {
        "type": "readout",
        "className": "component-readout",
        "label": "Tipo",
        "property": "polarity"
      },
      {
        "type": "readout",
        "className": "component-readout",
        "label": "Ic máx",
        "property": "maxCollectorCurrentAmps",
        "unit": "A"
      }
    ],
    "palette": {
      "group": "Semiconductors",
      "subgroup": "BJT NPN",
      "icon": "transistor-icon",
      "order": 99
    },
    "terminals": [
      {
        "id": "collector",
        "label": "C",
        "side": "top",
        "x": 45,
        "y": 0,
        "kind": "signal"
      },
      {
        "id": "base",
        "label": "B",
        "side": "left",
        "x": 0,
        "y": 54,
        "kind": "signal"
      },
      {
        "id": "emitter",
        "label": "E",
        "side": "bottom",
        "x": 105,
        "y": 104,
        "kind": "signal"
      }
    ]
  }
}
