{
  "$schema": "../../../schemas/component.schema.json",
  "schemaVersion": "1.0.0",
  "identity": {
    "id": "sensor.magnetic.hall.a3144",
    "name": "A3144 Hall Sensor",
    "category": "sensor",
    "subCategory": "magnetic"
  },
  "simulation": {
    "kind": "behavioral-sensor",
    "effects": ["firmware", "electrical", "visual-state"],
    "implemented": true
  },
  "properties": {
    "pressed": { "type": "boolean", "default": false, "simulationUpdate": "live" },
    "activeHigh": { "type": "boolean", "default": true, "simulationUpdate": "rerun" }
  },
  "terminals": [
    { "id": "vcc", "label": "VCC", "type": "power-input" },
    { "id": "out", "label": "OUT", "type": "digital-output" },
    { "id": "gnd", "label": "GND", "type": "ground" }
  ],
  "behavior": {
    "type": "momentary-button",
    "outputTerminal": "out",
    "activeProperty": "pressed",
    "activeHighProperty": "activeHigh"
  },
  "electricalModel": {
    "type": "sensor-module",
    "logicVoltage": 5,
    "recommendedVoltageVolts": 5,
    "inputCurrentAmps": 0.006,
    "maximumCurrentAmps": 0.02
  },
  "visual": {
    "type": "hall-a3144",
    "title": "A3144 Hall",
    "className": "maker-hall",
    "body": "NO MAGNET",
    "width": 176,
    "height": 104,
    "controls": [
      { "type": "readout", "className": "button-readout", "label": "Magnet", "property": "pressed", "format": "onOff" },
      { "type": "checkbox", "label": "Ímã presente", "property": "pressed" }
    ],
    "palette": { "group": "Sensors", "subgroup": "Magnetic", "icon": "hall-icon", "order": 77 },
    "terminals": [
      { "id": "vcc", "label": "VCC", "side": "left", "x": 0, "y": 28, "kind": "power" },
      { "id": "out", "label": "OUT", "side": "right", "x": 176, "y": 52, "kind": "signal" },
      { "id": "gnd", "label": "GND", "side": "bottom", "x": 88, "y": 104, "kind": "ground" }
    ]
  }
}
